title,authors,published_date,source,source_type,url,abstract,decision,category,highlight,rationale
Reusable surrogate models for distillation columns,"Martin Bubel, Tobias Seidel, Michael Bortz",2025-12-12,Computers & Chemical Engineering,Academic,https://doi.org/10.1016/j.compchemeng.2025.109523,,GOOD_TO_READ,Data Science & Modeling,"Focuses on developing reusable surrogate models, a transferable data-driven methodology, for chemical engineering systems.",The methodology (reusable surrogate models) is highly relevant for efficient simulation and optimization of complex mineral processing circuits.
Safe reinforcement learning via adaptive robust model predictive shielding,"Hilde Gerold, Sergio Lucia",2025-12-11,Computers & Chemical Engineering,Academic,https://doi.org/10.1016/j.compchemeng.2025.109521,,MUST_READ,Automation & AI Control,Proposes a method for safe reinforcement learning via adaptive robust model predictive shielding.,"This combines critical topics in Automation (MPC) and AI (RL), focusing on safety necessary for autonomous operation in mining."
Evaluating the potential of plastic waste upcycling using thermochemical technologies: A case study in Spain,"Roberto Cifuentes García, Evan D. Erickson, Mariano Martı́n, Ví­ctor M. Zavala",2025-12-11,Computers & Chemical Engineering,Academic,https://doi.org/10.1016/j.compchemeng.2025.109524,,GOOD_TO_READ,ESG & Sustainability,Evaluates the potential for plastic waste upcycling using thermochemical technologies in a circular economy context.,It addresses circular economy principles and waste valorisation strategies relevant to ESG and sustainability in the broader industrial context.
Amplifying photo-Fenton redox synergy in Fe2O3/CeO2 heterostructured nanotubes for efficient blue-LED-activated degradation at pH 5,"Zhengjiang Liu, Junjie Tang, Jiani Wu, Timur Borjigin, Bing Bai, Yaqiong Wang, He-Dong Huang",2025-12-11,Chemical Engineering Science,Academic,https://doi.org/10.1016/j.ces.2025.123172,,NOT_SURE,Environmental Chemistry,Study on amplifying photo-Fenton redox synergy in Fe2O3/CeO2 heterostructured nanotubes for efficient blue-LED-activated degradation.,"The focus is on specialized photocatalytic degradation, which may be relevant to water treatment but is not clearly tied to core extractive metallurgy or tailings based on the title alone."
Python-based BVP analysis of thermal performance in Maxwell hybrid nanofluid flow in a porous stretching sheet,"Li Long, Fathia Moh. Al Samman, Mhassen E.E. Dalam, Zahoor Shah, Mohammad Jawaid, Hamza Iqbal",2025-12-11,Chemical Engineering Science,Academic,https://doi.org/10.1016/j.ces.2025.123170,,NOT_SURE,Fluid Dynamics / Modeling,Python-based Boundary Value Problem (BVP) analysis of thermal performance in Maxwell hybrid nanofluid flow.,This highly theoretical fluid dynamics and heat transfer study lacks a clear application to mineral processing equipment or systems.
Mechanistic three‑dimensional analysis of profiled ion‑exchange membranes in reverse electrodialysis,"Dongxu Jin, Jialei Li, Ping Wang",2025-12-10,Chemical Engineering Science,Academic,https://doi.org/10.1016/j.ces.2025.123167,,GOOD_TO_READ,Hydrometallurgy / Separation,Mechanistic three-dimensional analysis of profiled ion-exchange membranes in reverse electrodialysis.,"Ion exchange and electrodialysis are relevant separation technologies for metal recovery, purification, and water management within hydrometallurgy."
Research on improving microparticle detection accuracy using negative pulse signals based on the Coulter principle,"Ruyue Yang, Zhijie Zhao, Yu Yang, Sheng Deng",2025-12-10,Chemical Engineering Science,Academic,https://doi.org/10.1016/j.ces.2025.123165,,GOOD_TO_READ,Sensors & Measurement / Fine Particles,Research on improving microparticle detection accuracy using negative pulse signals based on the Coulter principle.,"Accurate microparticle detection (sizing/counting) via methods like the Coulter principle is critical for process control, fine particle processing, and online measurement."
Selective and effective hydrogenation of biomass into high-value product over hierarchical MFI zeolite,"Zhengkai Cao, Sijia Ding, Yipin Lv, Rong Guo, Fuguang Liu, Ziming Wu, Sam Yang, Shuandi Hou, Daowei Gao, Xiangchen Fang",2025-12-10,Chemical Engineering Science,Academic,https://doi.org/10.1016/j.ces.2025.123164,,NOT_SURE,Chemical Synthesis,Focuses on selective and effective hydrogenation of biomass into high-value product over hierarchical MFI zeolite.,"This research is focused on biomass conversion and catalysis, not core mining, mineral processing, or extractive metallurgy operations."
Digital green governance and ESG outcomes: how executive digital orientation drives sustainable transformation in China’s mining enterprises,"Muhammad Umair, Fatima Gulzar, Saeed Ur Rahman",2025-12-10,Mineral Economics,Academic,https://doi.org/10.1007/s13563-025-00583-x,,MUST_READ,ESG & Sustainability / Data Science & AI,Examines how executive digital orientation and digital green governance drives ESG outcomes and sustainable transformation in China’s mining enterprises.,"This directly connects high-priority topics: ESG, sustainability, digital transformation, and executive strategy within the mining sector."
Techno-economic assessment of multi-element recovery from placer tailings: Transforming waste into value,"Hesam Dehghani, M. Abbasi",2025-12-10,Mineral Economics,Academic,https://doi.org/10.1007/s13563-025-00580-0,,MUST_READ,Tailings & Resource Economics,Focuses on the techno-economic feasibility of recovering valuable elements from placer tailings waste.,"Excellent intersection of sustainability, waste valorization, and economic feasibility analysis."
Review of quality assurance methods for hydro-powered resin bolting,"J. P. Gouvea, W. Geel",2025-11-24,OneMine (global),Repository,https://www.onemine.org/documents/review-of-quality-assurance-methods-for-hydro-powered-resin-bolting,"APA: J. P. Gouvea W. Geel (2025) Review of quality assurance methods for hydro-powered resin bolting MLA: J. P. Gouvea W. Geel Review of quality assurance methods for hydro-powered resin bolting . The Southern African Institute of Mining and Metallurgy , 2025 .",GOOD_TO_READ,Rock Mechanics,Reviews quality assurance methods specific to hydro-powered resin bolting used for ground support.,Useful for rock mechanics and ground control applications but not critical for core mineral processing or automation interests.
Application of the boundary element method for numerical modelling of the seismic hazard at Bambanani gold mine in South Africa,"N. de Koker, Y Jooste, J. Gerber",2025-11-24,OneMine (global),Repository,https://www.onemine.org/documents/application-of-the-boundary-element-method-for-numerical-modelling-of-the-seismic-hazard-at-bambanani-gold-mine-in-south-africa,"APA: J. Gerber N. de Koker Y Jooste (2025) Application of the boundary element method for numerical modelling of the seismic hazard at Bambanani gold mine in South Africa MLA: J. Gerber N. de Koker Y Jooste Application of the boundary element method for numerical modelling of the seismic hazard at Bambanani gold mine in South Africa . The Southern African Institute of Mining and Metallurgy , 2025 .",GOOD_TO_READ,Geotechnical Modelling,Uses the boundary element method for numerical modeling of seismic hazard in a deep gold mine.,"Relevant for deep mining safety and geotechnical modeling techniques, though not a core mineral processing modeling topic."
Rockburst risk management in deep hard rock mines: A multi-tiered approach with dynamic ground support as the last line of defense,B. Simser,2025-11-24,OneMine (global),Repository,https://www.onemine.org/documents/rockburst-risk-management-in-deep-hard-rock-mines-a-multi-tiered-approach-with-dynamic-ground-support-as-the-last-line-of-defense,"APA: B. Simser (2025) Rockburst risk management in deep hard rock mines: A multi-tiered approach with dynamic ground support as the last line of defense MLA: B. Simser Rockburst risk management in deep hard rock mines: A multi-tiered approach with dynamic ground support as the last line of defense . The Southern African Institute of Mining and Metallurgy , 2025 .",GOOD_TO_READ,Rock Mechanics & Safety,"Discusses a multi-tiered approach for managing rockburst risk in deep mines, emphasizing dynamic ground support.",Important practical guidance on high-risk geotechnical management in hard rock mining operations.
Rockbolts in shear,"J. Hadjigeorgiou, G. Knox",2025-11-24,OneMine (global),Repository,https://www.onemine.org/documents/rockbolts-in-shear,"MLA: G. Knox J. Hadjigeorgiou Rockbolts in shear . The Southern African Institute of Mining and Metallurgy , 2025 .",NOT_SURE,Rock Mechanics,Technical analysis focusing on the performance and behavior of rockbolts when subjected to shear forces.,"Too narrow and highly specialized in geotechnical engineering, making it low priority compared to processing or automation topics."
The role of stress and geology on the design of block cave mining sequences and layouts - a case study,"R. B. Khumalo, T. Chauke, T. Mtshali, F. K. Mulenga, B. Makgate, N. M. Chiloane, T. Moyane, V. C. Madanda",2025-11-24,OneMine (global),Repository,https://www.onemine.org/documents/the-role-of-stress-and-geology-on-the-design-of-block-cave-mining-sequences-and-layouts-a-case-study,"APA: T. Mtshali N. M. Chiloane B. Makgate T. Chauke F. K. Mulenga V. C. Madanda T. Moyane R. B. Khumalo (2025) The role of stress and geology on the design of block cave mining sequences and layouts - a case study MLA: T. Mtshali N. M. Chiloane B. Makgate T. Chauke F. K. Mulenga V. C. Madanda T. Moyane R. B. Khumalo The role of stress and geology on the design of block cave mining sequences and layouts - a case study . The Southern African Institute of Mining and Metallurgy , 2025 .",GOOD_TO_READ,Block Caving & Geometallurgy,A case study analyzing how geological factors and stress regimes influence the design and sequencing of block cave mining layouts.,"Provides practical insights into complex, high-tonnage mining method design informed by geological context."
